고문헌자료아이디,한약재아이디,한의서명,수록위치,고문헌원문,번역문,번역문출처
CLTX857,KMH183,본초강목,本草綱目 卷十三 > 草之二 山草類下三十九種 > 獨活 《本經》上品 > 〔發明〕,"好古曰羌活乃足太陽ㆍ厥陰ㆍ少陰藥, 與獨活不分二種. 後人因羌活氣雄, 獨活氣細. 故雄者, 治足太陽風濕相搏, 頭痛ㆍ肢節痛ㆍ一身盡痛者, 非此不能除, 乃却亂反正之主君藥也. 細者, 治足少陰伏風, 頭痛ㆍ兩足濕痺ㆍ不能動止者, 非此不能治, 而不治太陽之證.","왕호고는 ""독활은 족태양, 족궐음, 족소음에 쓰는 약으로, 독활과는 두 가지로 나뉘지 않는다. 후세 사람들이 광활의 기는 웅장하고 독활의 기는 약하다고 생각하였다. 그러므로 웅장한 것은 족태양경에서 풍습이 서로 치받아 발생한 두통이나 관절통, 온 몸이 아픈 증상에 이것이 아니면 제거할 수 없으니, 반란을 물리쳐 바로잡는 데 주군이 되는 약으로 여겼다. 약한 것은 족소음경에 잠복한 풍으로 인한 두통과 양 발의 습비(濕痺) 움직이지 못하는 증상에 이것이 아니면 치료할 수 없는 데다 태양경의 증상도 치료할 수 없다고 여겼다.""라고 하였다.",한의학고전DB
CLTX858,KMH183,본초강목,本草綱目 卷十三 > 草之二 山草類下三十九種 > 獨活 《本經》上品 > 〔發明〕,"時珍曰羌活ㆍ獨活皆能逐風勝濕, 透關利節, 但氣有剛劣不同爾. 《素問》云, 從下上者, 引而去之. 二味苦辛而溫, 味之薄者, 陰中之陽, 故能引氣上升, 通達周身, 而散風勝濕. 按文系曰, 唐劉師貞之兄病風, 夢神人曰, 但取胡王使者浸酒服, 便愈. 師貞訪問, 皆不曉. 復夢其母曰, 胡王使者, 卽羌活也. 求而用之, 兄疾遂愈.","이시진은 ""독활과 강활 모두 풍을 몰아내어 습을 이겨서 관절을 부드럽게 하지만 기의 강도가 같지 않다. 《황제내경소문》에서는 '아래에서 위로 올라가는 것은 이끌어 제거한다.' 하였다. 두 가지 약미가 쓰고 매우면서 성질이 따뜻한데, 맛이 엷은 것은 음 속의 양이므로 기를 이끌어 상승시켜서 온 몸에 두루 이르게 하여 풍을 흩어 내고 습을 누른다. 문계(文系)에 의하면 '당(唐)나라 유사정(劉師貞)의 형이 풍병을 앓았는데, 꿈에 신인(神人)이 나타나 〈호왕사자(胡王使者)만 술에 담가 복용하면 낫는다.〉라고 하였다. 유사정이 방법을 물었지만 다 이해하지 못하였다. 다시 꿈에 그 어미가 나타나 〈호왕사자는 강활이다.〉라고 하였다. 이것을 구하여 쓰자 그 형의 질병이 마침내 나았다.' 하였다.""라고 하였다.",한의학고전DB
CLTX859,KMH183,본초강목,本草綱目 卷十三 > 草之二 山草類下三十九種 > 獨活 《本經》上品 > 〔發明〕,"嘉謨曰羌活, 本手足太陽表裏引經之藥, 又入足少陰ㆍ厥陰. 名列君部之中, 非比柔懦之主. 小無不入, 大無不通. 故能散肌表八風之邪, 利周身百節之痛.","진가모(陳嘉謨)는 ""강활은 본래 수태양경과 족태양경의 안팎에 쓰는 인경약이고, 또한 족소음경과 족궐음경으로 들어간다. 이름이 군부(君部) 가운데에 나열되어 있으니, 유약한 주인에 비할 수 없다. 작게는 들어가지 않는 경우가 없고 크게는 통하지 않는 경우가 없다. 그러므로 피부와 표의 여덟 가지 풍사를 흩어 내고 온 몸의 관절의 통증을 낫게 한다.""라고 하였다.",한의학고전DB
CLTX860,KMH183,본초강목,本草綱目 卷十三 > 草之二 山草類下三十九種 > 獨活 《本經》上品 > 〔附方〕,"中風口, 通身冷, 不知人獨活四兩, 好酒一升, 煎半升服.《千金方》",중풍으로 이를 악물고 온 몸이 싸늘하며 남을 알아보지 못하는 증상:독활 4냥에 좋은 술 1되를 넣고 반 되가 될 때까지 달여 복용한다.《천금방》,한의학고전DB
CLTX861,KMH183,본초강목,本草綱目 卷十三 > 草之二 山草類下三十九種 > 獨活 《本經》上品 > 〔附方〕,"中風不語獨活一兩, 酒二升, 煎一升. 大豆五合, 炒有聲, 以藥酒熱投, 蓋之良久, 溫服三合, 未再服.《陳延之小品方》","중풍으로 말을 하지 못하는 증상:독활 1냥에 술 1되를 넣고 1되가 될 때까지 달인다. 대두 5홉을 소리가 날 때까지 볶은 다음 앞의 약주가 뜨거울 때 넣고 뚜껑을 덮어 시간이 지나면 따뜻할 때 3홉을 복용하는데, 낫지 않으면 다시 복용한다.《진연지소품방》",한의학고전DB
CLTX862,KMH183,본초강목,本草綱目 卷十三 > 草之二 山草類下三十九種 > 獨活 《本經》上品 > 〔附方〕,"熱風, 常擧發者羌活二斤, 構子一升, 爲末, 每酒服方寸匕, 日三服.《廣濟方》","열이나 풍으로 인한 탄탄()이 늘 발생할 때:강활 2근, 구자 1되를 가루 내고 술로 1방촌시씩 하루 세 번 복용한다.《광제방》",한의학고전DB
CLTX863,KMH183,본초강목,本草綱目 卷十三 > 草之二 山草類下三十九種 > 獨活 《本經》上品 > 〔附方〕,"産後中風語, 四肢拘急羌活三兩, 爲末, 每服五錢, 酒ㆍ水各一盞, 煎減半服.《小品方》",출산 후 중풍으로 말이 어눌해지고 팔다리가 당기는 증상:강활 3냥을 가루 내고 5돈씩 술과 물 각각 1잔씩 넣은 다음 절반이 될 때까지 달여 복용한다.《소품방》,한의학고전DB
CLTX864,KMH183,본초강목,本草綱目 卷十三 > 草之二 山草類下三十九種 > 獨活 《本經》上品 > 〔附方〕,"産後風虛獨活ㆍ白蘚皮各三兩, 水三升, 煮二升, 分三服. 耐酒者, 入酒同煮.《小品方》",출산 후 풍허:독활과 백선피 각 3냥에 물 3되를 넣고 2되가 될 때까지 달인 다음 세 번에 나누어 복용한다. 술을 마실 수 있는 자는 술을 넣고 달인다.《소품방》,한의학고전DB
CLTX865,KMH183,본초강목,本草綱目 卷十三 > 草之二 山草類下三十九種 > 獨活 《本經》上品 > 〔附方〕,"産後腹痛羌活二兩, 煎酒服.《必效方》",출산 후의 복통:강활 2냥을 술에 넣고 달여 복용한다.《필효방》,한의학고전DB
CLTX866,KMH183,본초강목,本草綱目 卷十三 > 草之二 山草類下三十九種 > 獨活 《本經》上品 > 〔附方〕,産腸脫出方同上.《子母秘錄》,출산 후 장이 빠져나온 증상:처방은 앞과 같다.《자모비록》,한의학고전DB
CLTX867,KMH183,본초강목,本草綱目 卷十三 > 草之二 山草類下三十九種 > 獨活 《本經》上品 > 〔附方〕,"妊娠浮腫羌活ㆍ蘿蔔子同炒香, 只取羌活爲末. 每服二錢, 溫酒調下, 一日一服, 二日二服, 三日三服. 乃嘉興簿張昌明所傳.《許學士本事方》","임산부의 부종:강활과 나복자를 함께 향이 날 때까지 볶은 다음 강활만 골라 가루 낸다. 이것을 2돈씩 따뜻한 술에 타서 복용하는데, 첫째 날은 한 번 복용하고, 둘째 날은 두 번 복용하고, 셋째 날은 세 번 복용한다. 이 처방은 가흥 주부(嘉興主簿) 장창명(張昌明)이 전한 것이다.《허학사본사방》",한의학고전DB
CLTX868,KMH183,본초강목,本草綱目 卷十三 > 草之二 山草類下三十九種 > 獨活 《本經》上品 > 〔附方〕,風水浮腫方同上.,풍과 수로 인한 부종:처방은 앞과 같다.,한의학고전DB
CLTX869,KMH183,본초강목,本草綱目 卷十三 > 草之二 山草類下三十九種 > 獨活 《本經》上品 > 〔附方〕,"歷節風痛獨活ㆍ羌活ㆍ松節等分, 用酒煮過, 每日空心飮一杯.《外臺秘要》",역절풍으로 아픈 증상:독활ㆍ강활ㆍ송절 같은 양을 술에 넣고 달인 다음 매일 빈속에 1잔씩 마신다.《외대비요》,한의학고전DB
CLTX870,KMH183,본초강목,本草綱目 卷十三 > 草之二 山草類下三十九種 > 獨活 《本經》上品 > 〔附方〕,"風牙腫痛《後方》用獨活煮酒, 熱漱之. 文潞公《藥準》用獨活ㆍ地黃各三兩, 爲末, 每服三錢, 水一盞煎, 和滓溫服, 臥時再服.","風牙腫痛《後方》用獨活煮酒, 熱漱之. 文潞公《藥準》用獨活ㆍ地黃各三兩, 爲末, 每服三錢, 水一盞煎, 和滓溫服, 臥時再服.",한의학고전DB
CLTX871,KMH183,본초강목,本草綱目 卷十三 > 草之二 山草類下三十九種 > 獨活 《本經》上品 > 〔附方〕,"喉閉口羌活三兩, 牛蒡子二兩, 水煎一鍾, 入白礬少許, 灌之取效.《聖濟錄》","목구멍이 막혀 이를 악물고 있는 증상:강활 3냥, 우방자 2냥에 물 1잔을 넣고 백반을 약간 넣은 다음 부어 주면 효과가 난다.《성제록》",한의학고전DB
CLTX872,KMH183,본초강목,本草綱目 卷十三 > 草之二 山草類下三十九種 > 獨活 《本經》上品 > 〔附方〕,"睛垂至鼻人睛忽垂至鼻, 如黑角塞, 痛不可忍, 或時時大便血出痛, 名曰肝脹. 用羌活煎汁, 服數盞, 自愈.《夏子益奇疾方》","눈동자가 늘어져 코에 이르는 증상:사람의 눈동자가 갑자기 늘어져 코에 이르러 흑각(黑角)과 같은 모양이 되고 참을 수 없이 아프거나, 혹 때때로 대변에서 피가 나오는 것을 간창(肝脹)이라 한다. 강활을 달여 낸 즙을 몇 잔 마시면 저절로 낫는다.",한의학고전DB
CLTX873,KMH183,본초강목,本草綱目 卷十三 > 草之二 山草類下三十九種 > 獨活 《本經》上品 > 〔附方〕,"太陽頭痛羌活ㆍ防風ㆍ紅豆等分, 爲末, 鼻.《玉機微義》",태양두통:강활ㆍ방풍ㆍ홍두 같은 양을 가루 내어 코에 불어 넣는다.《옥기미의》,한의학고전DB
CLTX874,KMH219,본초강목,本草綱目 卷十五 > 草之四 草類上五十三種 > 麻黃 《本經》中品 > 〔釋名〕,龍沙(本經) 卑相(別錄) 卑鹽(別錄),용사(본경) 비상(별록) 비염(별록),한의학고전DB
CLTX875,KMH219,본초강목,本草綱目 卷十五 > 草之四 草類上五十三種 > 麻黃 《本經》中品 > 〔釋名〕,"時珍曰諸名殊不可解. 或云其味麻, 其色黃, 未審然否 張揖《廣雅》云, 龍沙, 麻黃也. 狗骨, 麻黃根也. 不知何以分別如此","이시진은 ""여러 이름이 달라서 해석할 수 없다. 혹 그것이 삼 맛이 나고 황색이라고 하는데 그러한지 아닌지 모르겠다. 장읍(張揖)의 《광아(廣雅)》에서는 '용사(龍沙)는 마황이다. 구골(狗骨)은 마황 뿌리이다.' 하였다. 어떻게 이와 같이 분별했는지 모르겠다.""라고 하였다.",한의학고전DB
CLTX876,KMH219,본초강목,本草綱目 卷十五 > 草之四 草類上五十三種 > 麻黃 《本經》中品 > 〔集解〕,"《別錄》曰麻黃生晉地及河東, 立秋采莖, 陰乾令靑.","《명의별록》에서는 ""마황은 진(晉) 지역 및 하동(河東)에서 나고, 입추(立秋)에 줄기를 채취하여 푸르게 되도록 그늘에 말린다.""라고 하였다.",한의학고전DB
CLTX877,KMH219,본초강목,本草綱目 卷十五 > 草之四 草類上五十三種 > 麻黃 《本經》中品 > 〔集解〕,"弘景曰今出靑州ㆍ彭城ㆍ滎陽ㆍ中牟者爲勝, 色靑而多沫. 蜀中亦有, 不好.","도홍경은 ""지금은 청주(靑州), 팽성(彭城), 형양(滎陽), 중모(中牟)에서 나는 것을 좋게 여기는데, 색이 푸르면서 거품이 많다. 촉 지역에도 있는데 좋지 못하다.""라고 하였다.",한의학고전DB
CLTX878,KMH219,본초강목,本草綱目 卷十五 > 草之四 草類上五十三種 > 麻黃 《本經》中品 > 〔集解〕,"恭曰鄭州鹿臺及關中沙苑河旁沙洲上最多. 同州沙苑亦多, 其靑ㆍ徐者亦不復用.","소공은 ""정주(鄭州)의 녹대(鹿臺) 및 관중(關中)의 사원(沙苑)에 있는 강가와 모래톱에 가장 많다. 같은 주의 사원에 이미 많으며 청주와 서주에서 나는 것도 쓰지 않는다.""라고 하였다.",한의학고전DB
CLTX879,KMH219,본초강목,本草綱目 卷十五 > 草之四 草類上五十三種 > 麻黃 《本經》中品 > 〔集解〕,"禹錫曰按段成式《酉陽雜俎》云, 麻黃莖頭開花, 花小而黃, 叢生. 子如覆盆子, 可食.","장우석은 ""단성식(段成式)의 《유양잡조(酉陽雜俎)》에서는 '마황은 줄기 끝에서 꽃이 피는데, 꽃이 작고 황색이며 무리지어 난다. 씨는 산딸기와 같고 먹을 수 있다.' 하였다.""라고 하였다.",한의학고전DB
CLTX880,KMH219,본초강목,本草綱目 卷十五 > 草之四 草類上五十三種 > 麻黃 《本經》中品 > 〔集解〕,"頌曰今近京多有之, 以滎陽ㆍ中牟者爲勝. 春生苗, 至夏五月則長及一尺以來. 梢上有黃花, 結實如百合瓣而小, 又似莢子, 味, 微有麻黃氣, 外皮紅, 裏仁子黑. 根紫赤色. 俗說有雌雄二種, 雌者於三月四月內開花, 六月結子. 雄者無花, 不結子. 至立秋後收莖陰乾.","소송은 ""지금은 변경(京) 주변에도 많이 있는데, 형양(滎陽)과 중모(中牟)에서 나는 것을 좋게 여긴다. 봄에 싹이 나고 5월이 되면 길이가 1척 정도 된다. 끝에서 노란 꽃이 피고 백합의 외씨와 같은 열매가 맺히면서 작거나 또는 조각자와 유사하고 맛이 달며 마황의 냄새가 약간 있다. 겉 껍질은 붉고 속의 씨는 검다. 뿌리는 자적색이다. 속설에는 암수 두 종이 있는데, 암컷은 3월과 4월 중에 꽃이 피고 6월에 열매를 맺는다. 수컷은 꽃이 없어 열매를 맺지 않는다고 한다. 입추 이후에 줄기를 채취하여 그늘에 말린다.""라고 하였다.",한의학고전DB
CLTX881,KMH219,본초강목,本草綱目 卷十五 > 草之四 草類上五十三種 > 麻黃 《本經》中品 > 〔集解〕,"時珍曰其根皮色黃赤, 長者近尺.","이시진은 ""뿌리 껍질의 색은 황적색이고 길이는 1척에 가깝다.""라고 하였다.",한의학고전DB
CLTX882,KMH219,본초강목,本草綱目 卷十五 > 草之四 草類上五十三種 > 麻黃 《本經》中品 > 〔附錄〕 > 雲花子,"時珍曰按葛洪《後方》治馬疥, 有雲花草, 云狀如麻黃, 而中堅實也.","이시진은 ""갈홍(葛洪)의 《주후방(後方)》에서는 마개(馬疥)를 치료하는 운화초가 있다고 하였는데, 모양이 마황과 같지만 속이 단단하고 실하다고 한다.""라고 하였다.",한의학고전DB
CLTX883,KMH219,본초강목,本草綱目 卷十五 > 草之四 草類上五十三種 > 麻黃 《本經》中品 > 莖 > 修治,"弘景曰用之折去節根, 水煮十餘沸, 以竹片掠去上沫, 沫令人煩, 根節能止汗故也.","도홍경은 ""쓸 때는 마디와 뿌리를 잘라 없애고 물에 넣고 달여 10여 차례 끓어오르면 대나무 조각으로 위에 뜬 거품을 제거하는데, 거품은 사람을 답답하게 만들고, 뿌리와 마디는 땀을 멎게 하기 때문이다.""라고 하였다.",한의학고전DB
CLTX884,KMH219,본초강목,本草綱目 卷十五 > 草之四 草類上五十三種 > 麻黃 《本經》中品 > 莖 > 氣味,"苦, 溫, 無毒.①《別錄》曰微溫. ②普曰神農ㆍ雷公, 苦, 無毒, 扁鵲, 酸, 李當之, 平. ③權曰甘, 平. ④元素曰性溫, 味苦而甘辛, 氣味俱薄, 輕淸而浮, 陽也, 升也. 手太陰之藥, 入足太陽經, 兼走手少陰ㆍ陽明. ⑤時珍曰麻黃微苦而辛, 性熱而輕揚. 僧繼洪云, 中牟有麻黃之地, 冬不積雪, 爲泄內陽也. 故過用則泄眞氣. 觀此則性熱可知矣. 服麻黃自汗不止者, 以冷水浸頭髮, 仍用撲法卽止. 凡服麻黃藥, 須避風一日, 不爾病復作也. 凡用須佐以黃芩, 則無赤眼之患. ⑥之才曰厚朴ㆍ白薇爲之使. 惡辛夷ㆍ石葦.","맛은 쓰고 성질은 따뜻하고 독이 없다.①《명의별록》에서는 ""성질이 약간 따뜻하다.""라고 하였다. ②오보는 ""신농ㆍ뇌공은 '맛이 쓰고 독이 없다.' 하였고, 편작은 '맛이 시다.' 하였고, 이당지는 '성질이 평하다.' 하였다.""라고 하였다. ③견권은 ""맛이 달고 성질이 평하다.""라고 하였다. ④장원소는 ""성질이 따뜻하고 맛이 쓰면서 달고 매우니 기미가 모두 엷고 가볍고 얇으면서 떠서 양이고 올라간다. 수태음경에 쓰는 약이고 족태음경으로 들어가면서 아울러 수소음경과 수소양경으로 내달린다.""라고 하였다. ⑤이시진은 ""마황은 맛이 약간 쓰면서 맵고 성질이 뜨거우면서 가볍게 날린다. 승계홍(僧繼洪)은 '중모(中牟)의 마황이 나는 땅은 겨울에도 눈이 쌓이지 않는데 안에서 양이 새어 나가기 때문이다. 그러므로 지나치게 쓰면 진기를 새어 나가게 한다.' 하였다. 이것으로 보자면 성질이 뜨겁다는 것을 알 수 있다. 마황을 복용하고 자한이 멎지 않으면 찬 물에 머리를 감고 곧바로 박법(撲法)을 쓰면 멎는다. 마황이 들어간 약을 복용하면 하루 동안 바람을 피해야 병이 다시 발생하지 않는다. 황금을 좌약(佐藥)으로 쓰면 눈이 벌겋게 되는 질환이 없게 된다.""라고 하였다. ⑥서지재는 ""후박과 백미가 사(使)가 된다. 신이와 석위를 싫어한다.""라고 하였다.",한의학고전DB
CLTX885,KMH219,본초강목,本草綱目 卷十五 > 草之四 草類上五十三種 > 麻黃 《本經》中品 > 莖 > 主治,"中風傷寒頭痛, 溫, 發表出汗, 去邪熱氣, 止咳逆上氣, 除寒熱, 破堅積聚.本經 五臟邪氣緩急, 風脅痛, 字乳餘疾, 止好唾, 通理, 解肌, 洩邪惡氣, 消赤黑斑毒. 不可多服, 令人虛.別錄 治身上毒風疹痺, 皮肉不仁, 主壯熱溫疫, 山嵐氣.甄權 通九竅, 調血脈, 開毛孔皮膚.大明 去營中寒邪, 泄衛中風熱.元素 散赤目腫痛, 水腫風腫, 産後血滯.時珍","중풍이나 상한으로 인한 두통, 온학을 치료한다. 표(表)를 발산시켜 땀이 나게 하고, 사기와 열기를 제거하며, 해역으로 치받는 기를 멎게 하며, 한열을 제거하고, 단단한 징가와 적취를 깨뜨린다.본경 오장의 사기가 오락가락하는 증상, 풍으로 옆구리가 아픈 증상, 출산 후 남아 있는 질병 등을 치료한다. 잠만 자려는 것을 멎게 하고, 주리(奏理)를 소통시키며, 피부를 풀어 주고, 사기와 악기를 새어 나가게 하며, 붉고 검은 반점이나 독을 삭인다. 많이 복용하면 안 되는데, 사람을 허하게 한다.별록 몸 표면의 풍독으로 인한 군비, 피부가 마비된 증상을 치료하고, 심한 열이 나는 온역, 산람장기 등을 주치한다.견권 구규를 통하게 하고 혈맥을 고르게 하며, 털 구멍과 피부를 열리게 한다.대명 영(營) 속의 한사를 제거하고 위(衛) 속의 풍열을 새어 나가게 한다.원소 눈에 핏발이 서거나 붉고 아픈 것, 수종이나 풍종, 출산 후 막힌 혈 등을 흩어 낸다.시진",한의학고전DB
CLTX886,KMH219,본초강목,本草綱目 卷十五 > 草之四 草類上五十三種 > 麻黃 《本經》中品 > 莖 > 發明,"弘景曰麻黃療傷寒, 解肌第一藥.","도홍경은 ""마황은 상한을 치료하고 피부를 풀어 주는 가장 으뜸인 약이다.""라고 하였다.",한의학고전DB
CLTX887,KMH219,본초강목,本草綱目 卷十五 > 草之四 草類上五十三種 > 麻黃 《本經》中品 > 莖 > 發明,"頌曰張仲景治傷寒, 有麻黃湯及葛根湯ㆍ大小靑龍湯, 皆用麻黃. 治肺瘻上氣, 有射干麻黃湯ㆍ厚朴麻黃湯, 皆大方也.","소송은 ""장중경(張仲景)이 상한을 치료한 마황탕(麻黃湯) 및 갈근탕(葛根湯), 대청룡탕(大靑龍湯), 소청룡탕(小靑龍湯)에는 모두 마황을 썼다. 폐위(肺)로 기가 치받는 증상을 치료한 사간마황탕(射干麻黃湯), 후박마황탕(厚朴麻黃湯)은 모두 가장 일반적인 방법이다.""라고 하였다.",한의학고전DB
CLTX888,KMH219,본초강목,本草綱目 卷十五 > 草之四 草類上五十三種 > 麻黃 《本經》中品 > 莖 > 發明,"曰輕可去實, 麻黃ㆍ葛根之屬是也. 六淫有餘之邪, 客於陽分皮毛之間, 理閉拒, 營衛氣血不行, 故謂之實. 二藥輕淸成象, 故可去之. 麻黃微苦, 其形中空, 陰中之陽, 入足太陽寒水之經. 其經循背下行, 本寒而又受外寒, 故宜發汗, 去皮毛氣分寒邪, 以泄表實. 若過發則汗多亡陽, 或飮食勞倦及雜病自汗表虛之證用之, 則脫人元氣, 不可不禁.","이고는 ""가벼운 것은 실증을 제거할 수 있는데, 마황과 갈근 같은 것들이다. 육음(六淫)에 남아 있는 사기가 양분(陽分)의 피부와 털 사이에 들어가 주리가 닫히고 영위의 기혈이 운행하지 않으므로 실증이라 말한다. 두 가지 약은 가볍고 맑은 형상을 이루므로 제거할 수 있다. 마황은 맛이 약간 쓰고 모양은 속이 비어 있으니 음 속의 양이고 족태양한수의 경락으로 들어간다. 등 아래를 돌아 운행하여 본래 찬 데다 또 외부의 한사를 받으므로 땀을 내어서 피부와 털의 기분(氣分)에 있는 한사를 제거하고 표의 실증을 새어 나가게 해야 한다. 만약 지나치게 발산시키면 땀이 많이 나서 망양증(亡陽證)이 된다. 혹은 음식상, 노권상 및 잡병으로 자한이 나고 표가 허한 증상에 쓰게 되면 사람의 원기를 빠져나가게 하니, 금하지 않으면 안 된다.""라고 하였다.",한의학고전DB
CLTX889,KMH219,본초강목,本草綱目 卷十五 > 草之四 草類上五十三種 > 麻黃 《本經》中品 > 莖 > 發明,"好古曰麻黃治衛實之藥, 桂枝治衛虛之藥, 二物雖爲太陽證藥, 其實營衛藥也. 心主營爲血, 肺主衛爲氣. 故麻黃爲手太陰肺之劑, 桂枝爲手少陰心之劑. 傷寒傷風而咳嗽, 用麻黃ㆍ桂枝, 卽湯液之源也.","왕호고는 ""마황은 위(衛)가 실한 증상을 치료하는 약이고, 계지는 위(衛)가 허한 증상을 치료하는 약으로, 두 가지는 태양증에 쓰는 약으로 여기지만 실제로는 영위(營衛)에 쓰는 약이다. 심은 영(營)을 주관하여 혈이 되고, 폐는 위(衛)를 주관하여 기가 된다. 그러므로 마황은 수태음의 폐에 쓰는 약이 되고, 계지는 수소음의 심에 쓰는 약이 된다. 상한이나 상풍으로 기침이 날 때 쓰는 마황과 계지는 곧 탕액의 근원이 된다.""라고 하였다.",한의학고전DB
CLTX890,KMH219,본초강목,本草綱目 卷十五 > 草之四 草類上五十三種 > 麻黃 《本經》中品 > 莖 > 發明,"時珍曰麻黃乃肺經專藥, 故治肺病多用之. 張仲景治傷寒無汗用麻黃, 有汗用桂枝. 歷代明醫解釋, 皆隨文傅會, 未有究其精微者. 時珍常釋思之, 似有一得, 與昔人所解不同云. 津液爲汗, 汗卽血也. 在營則爲血, 在衛則爲汗. 夫寒傷營, 營血內, 不能外通於衛, 衛氣閉固, 津液不行, 故無汗發熱而憎寒. 夫風傷衛, 衛氣外泄, 不能內護於營, 營氣虛弱, 津液不固, 故有汗發熱而惡風. 然風寒之邪, 皆由皮毛而入. 皮毛者, 肺之合也. 肺主衛氣, 包羅一身, 天之象也. 是證雖屬乎太陽, 而肺實受邪氣. 其證時兼面赤鬱, 咳嗽有痰, 喘而胸滿諸證者, 非肺病乎 蓋皮毛外閉, 則邪熱內攻, 而肺氣鬱. 故用麻黃ㆍ甘草同桂枝, 引出營分之邪, 達之肌表, 佐以杏仁泄肺而利氣. 汗後無大熱而喘者, 加以石膏.","이시진은 ""마황은 폐경(肺經)에만 쓰는 약이므로 폐병을 치료할 때 많이 쓴다. 장중경은 상한에 땀이 나지 않는 증상을 치료할 때 마황을 썼고, 땀이 나는 증상에는 계지를 썼다. 역대 명의들이 해석한 것은 모두 문장만 따라서 억지로 붙였지 그 정미함을 연구하지 않았다. 나는 늘 연구하고 생각하여 한 가지를 얻은 듯한데, 옛사람들이 해석한 바와는 같지 않다. 진액은 땀이 되고 땀은 곧 혈이다. 영(營)에 있으면 혈이 되고, 위(衛)에 있으면 땀이 된다. 한(寒)으로 영을 상하여 영혈이 안에서 껄끄러워져 밖으로 위(衛)로 통할 수 없으면 위기가 단단히 닫혀서 진액이 운행할 수 없으므로 땀이 나지 않고 열이 나면서 오한이 생긴다. 풍으로 위를 상하여 위기가 밖으로 새어 나가 안에서 영을 보호할 수 없으면 영기가 허약해져 진액이 굳건해지지 못하므로 땀이 나고 열이 나면서 오풍이 생긴다. 그렇지만 풍한의 사기는 모두 피부와 털에서부터 들어간다. 피부와 털은 폐에서 만들어진다. 폐는 위기를 주관하여 온 몸을 감싸고 있는 하늘과 땅의 형상이다. 이 증상은 태양(太陽)에 속하지만 폐는 실제로 사기를 받은 것이다. 이 증상에 때로 얼굴이 벌개지고 울화가 뭉치거나, 가래가 끓는 기침이 나거나, 숨을 헐떡이면서 가슴이 그득한 여러 증상을 겸하고 있으니 폐병이 아니겠는가. 피부와 털이 외부에서 닫히면 사열이 안에서 공격하여 폐기가 쌓이고 막힌다. 그러므로 마황ㆍ감초는 계지와 함께 영분의 사기를 끌어내어 기표(肌表)에 도달하게 하며, 행인이 좌약(佐藥)이 되어 폐에서 새어 나가게 하여 기를 소통시킨다. 땀을 낸 뒤에 큰 열은 없지만 숨을 헐떡일 때는 석고를 더한다.",한의학고전DB
