고문헌자료아이디,한약재아이디,한의서명,수록위치,고문헌원문,번역문,번역문출처
CLTX1523,KMH326,본초강목,本草綱目 卷十七 上 > 草之六 毒草類一十七種 > 附子 《本經》下品 > 〔附方〕,"久患口瘡生附子爲末, 醋ㆍ調貼足心, 男左女右, 日再換之.《經驗》","오랜 구창(口瘡):생부자를 가루 내고 식초와 밀가루에 개어 발바닥 가운데에 붙여 주는데, 남자는 왼쪽, 여자는 오른쪽에 붙여 주고, 하루에 두 번 갈아 준다.《경험후방》",한의학고전DB
CLTX1524,KMH326,본초강목,本草綱目 卷十七 上 > 草之六 毒草類一十七種 > 附子 《本經》下品 > 〔附方〕,"風蟲牙痛《普濟方》用附子一兩燒灰, 枯礬一分, 爲末, 之. 又方, 川烏頭ㆍ川附子生硏, 糊丸小豆大. 每綿包一丸咬之. 《刪繁方》用附子末, 納孔中乃止.","풍치나 충치로 이가 아픈 증상:《보제방(普濟方)》에서는 ""부자 1냥(태워 재를 낸다)과 고백반 1푼을 가루 내어 환부를 문질러 준다. 다른 처방으로는, 천오두와 천부자 생 것을 가루 내고 밀가루풀에 개어 소두만 한 환약을 만든다. 이것을 면에 1환씩 싸서 물고 있게 한다.""라고 하였다. 《산번방(刪繁方)》에서는 ""부자를 습지에 싸서 굽고 가루 낸 다음 충치나 풍치 구멍 속에 넣으면 바로 멎는다.""라고 하였다.",한의학고전DB
CLTX1525,KMH326,본초강목,本草綱目 卷十七 上 > 草之六 毒草類一十七種 > 附子 《本經》下品 > 〔附方〕,"眼暴赤腫, 痛不得開, 淚出不止削附子赤皮末, 如蠶砂大, 著中, 以定爲度.《張文仲備急方》",눈이 갑자기 벌개지면서 붓거나 모래가 들어간 듯이 아파서 눈을 뜨지 못하고 눈물이 멈추지 않는 증상:부자의 붉은 껍질을 깎아 버리고 가루 낸 다음 잠사(蠶砂) 크기로 눈자에 떨어뜨려 주는데 진정될 때까지 한다.《장문중비급방》,한의학고전DB
CLTX1526,KMH326,본초강목,本草綱目 卷十七 上 > 草之六 毒草類一十七種 > 附子 《本經》下品 > 〔附方〕,"一切冷氣去風痰, 定遍身疼痛, 益元氣, 强力, 固精益髓, 令人少病. 川烏頭一斤, 用五升大甕子盛, 以童子小便浸七日, 逐日添令溢出, 揀去壞者不用. 餘以竹刀切作四片, 新汲水淘七次, 乃浸之, 日日換水, 日足, 取焙爲末, 酒煮糊丸綠豆大. 每服十丸, 空心鹽湯下, 少粥飯壓之.《經驗方》","온갖 냉기:풍담을 제거하고, 온몸의 통증을 진정시키며, 원기를 북돋아 주고, 정력을 강하게 하며, 정(精)을 굳세게 하고 골수를 보익하여 사람이 병에 적게 걸리게 한다. 천오두 1근을 5되들이 사발에 채우고 동변을 넣어 7일 동안 담가 두되, 날마다 동변을 넘칠 정도로 더하며, 썩은 것은 가려내고 쓰지 않는다. 나머지 것을 대나무칼로 4조각씩 쪼개어 새로 길어 온 물에 7차례 일어낸 다음 그대로 담가두고 날마다 물을 갈아 준다. 날 수를 충분하게 채웠으면 불기운에 말려 가루 내고 술을 넣고 쑨 밀가루풀에 개어 녹두만 한 환약을 만든다. 이것을 10환씩 빈속에 소금을 넣고 끓인 물로 복용하고 죽을 조금 먹어서 눌러 준다.《경험방》",한의학고전DB
CLTX1527,KMH326,본초강목,本草綱目 卷十七 上 > 草之六 毒草類一十七種 > 附子 《本經》下品 > 〔附方〕,"升降諸氣, 暖則宣流熟附子一大個, 分作二服, 水二盞, 煎一盞, 入沈香汁溫服.《和劑局方》",오르내리는 여러 기는 따뜻해지면 흩어져서 움직인다:익힌 부자 큰 것 1개를 두 번 복용할 분량으로 나누어 물 2잔을 넣고 1잔이 될 때까지 달인 다음 침향즙을 넣고 따뜻하게 하여 복용한다.《화제국방》,한의학고전DB
CLTX1528,KMH326,본초강목,本草綱目 卷十七 上 > 草之六 毒草類一十七種 > 附子 《本經》下品 > 〔附方〕,"中寒昏困薑附湯, 治體虛中寒, 昏不知人, 及臍腹冷痛, 亂轉筋, 一切虛寒之病. 生附子一兩去皮臍, 乾薑一兩, 每服三錢, 水二鍾, 煎一鍾, 溫服.《和劑局方》","중한으로 혼곤한 증상:강부탕(薑附湯)은 몸이 허하여 한사(寒邪)가 침입해 들어와 혼미하여 정신을 차리지 못하는 증상과 배꼽과 배가 차갑고 아픈 증상, 곽란으로 근이 뒤틀리는 증상, 온갖 허한한 병을 치료한다. 생부자 1냥(껍질과 배꼽을 제거한다)과 건강(습지에 싸서 굽는다) 1냥을 준비해 3돈씩 물 2잔에 넣고 1잔이 될 때까지 달여 따뜻할 때 복용한다.《화제국방》",한의학고전DB
CLTX1529,KMH326,본초강목,本草綱目 卷十七 上 > 草之六 毒草類一十七種 > 附子 《本經》下品 > 〔附方〕,"心腹冷痛冷熱氣不和. 山梔子ㆍ川烏頭等分, 生硏爲末, 酒糊丸梧子大. 每服十五丸, 生薑湯下. 小腸氣痛, 加炒茴香, 蔥酒下二十丸.《王氏博濟方》",가슴과 배가 차고 아픈 증상:냉기와 열기가 조화롭지 못하기 때문이다. 산치자와 천오두 같은 양을 생으로 가루 낸 다음 술을 넣고 쑨 풀에 개어 벽오동씨만 한 환약을 만든다. 이것을 15환씩 생강 달인 물로 복용한다. 소장기(小腸氣)로 아플 때는 볶은 회향을 더하여 파를 넣은 술로 20환을 복용한다.《왕씨박제방》,한의학고전DB
CLTX1530,KMH326,본초강목,本草綱目 卷十七 上 > 草之六 毒草類一十七種 > 附子 《本經》下品 > 〔附方〕,"心痛疝氣濕熱因寒鬱而發. 用梔子降濕熱, 烏頭破寒鬱. 烏頭爲梔子所引, 其性急速, 不留胃中也. 川烏頭ㆍ山梔子各一錢, 爲末, 順流水入薑汁一匙, 調下.《丹溪纂要》","산기(疝氣)로 가슴이 아픈 증상:한사(寒邪)로 습열(濕熱)이 막혀서 발생한다. 치자는 습열을 내리고 오두는 한기가 울결된 것을 깨뜨린다. 오두는 치자를 인경약으로 삼는데, 그 성질이 급하고 신속하여 위(胃) 속에 머물지 않는다. 천오두와 산치자 각 1돈을 가루 내고 생강즙을 넣은 순류수(順流水)에 1술을 타서 복용한다.《단계찬요》",한의학고전DB
CLTX1531,KMH326,본초강목,本草綱目 卷十七 上 > 草之六 毒草類一十七種 > 附子 《本經》下品 > 〔附方〕,"寒厥心痛, 及小腸膀胱痛不可止者神砂一粒丹. 用熟附子去皮ㆍ鬱金ㆍ橘紅各一兩, 爲末, 醋糊丸如酸棗大, 朱砂爲衣. 每服一丸, 男子酒下, 女人醋湯下.《宣明方》",한궐로 가슴이 아프거나 소장과 방광의 통증이 멎지 않는 증상:신사일립단(神砂一粒丹)을 쓴다. 익힌 부자(껍질을 제거한다)ㆍ울금ㆍ귤홍 각 1냥을 가루 낸 다음 식초를 넣고 쑨 밀가루풀에 개어 대추만한 환약을 만들고 주사로 겉을 입힌다. 이것을 1환씩 남자는 술로 복용하고 여자는 식초 달인 물로 복용한다.《선명방》,한의학고전DB
CLTX1532,KMH326,본초강목,本草綱目 卷十七 上 > 草之六 毒草類一十七種 > 附子 《本經》下品 > 〔附方〕,"寒疝腹痛繞臍, 手足厥冷, 自汗出, 脈弦而緊用大烏頭煎主之. 大烏頭五枚去臍, 水三升, 煮取一升, 去滓, 納蜜二升, 煎令水氣盡. 强人服七合, 弱人服五合. 不, 明日更服.《張仲景金玉函方》","한산(寒疝)으로 배와 배꼽 둘레까지 아프거나, 손발이 싸늘하거나, 자한(自汗)이 나거나 맥이 현하면서 긴한 증상:대오두전(大烏頭煎)으로 주치한다. 큰 오두 5개를 배꼽을 제거하고 물 3되를 넣어 1되가 될 때까지 달인 다음 찌꺼기를 제거하고 다시 꿀 2되를 넣어 물기가 다 마를 때까지 달인다. 튼튼한 사람은 7홉을, 허약한 사람은 5홉을 복용한다. 낫지 않으면 다음 날 다시 복용한다.《장중경금궤옥함방》",한의학고전DB
CLTX1533,KMH326,본초강목,本草綱目 卷十七 上 > 草之六 毒草類一十七種 > 附子 《本經》下品 > 〔附方〕,"寒疝身痛腹痛, 手足逆冷不仁, 或身痛不能眠用烏頭桂枝湯主之. 烏頭一味, 以蜜二斤, 煎減半, 入桂枝湯五合解之, 得一升. 初服二合, 不知再服, 又不知, 加至五合. 其知者如醉狀, 得吐爲中病也.《金玉函》","한산으로 몸이나 배가 아프거나, 손발이 싸늘하고 움직이지 못하는 증상 혹은 몸이 아파 잠을 못 자는 증상:오두계지탕(烏頭桂枝湯)으로 주치한다. 오두 하나로 된 약미에 꿀 2근을 넣고 절반의 양이 될 때까지 달인 후 계지탕(桂枝湯) 5홉을 넣어 풀어 주면 1되를 얻을 수 있다. 처음에는 2홉을 복용하는데, 효과가 없으면 다시 복용하고, 또 효과가 없으면 5홉까지 복용한다. 효과가 나서 술에 취한 듯한 상태가 되고 토하는 것은 약이 그 병에 잘 맞는 것이다.《금궤옥함》",한의학고전DB
CLTX1534,KMH326,본초강목,本草綱目 卷十七 上 > 草之六 毒草類一十七種 > 附子 《本經》下品 > 〔附方〕,"寒疝引脅, 肋心腹皆痛, 諸藥不效者大烏頭五枚去角四破, 以白蜜一斤, 煎令透, 取焙爲末. 別以熟蜜和丸梧子大. 每服二十丸, 冷鹽湯下, 永除.《崔氏方》","한산으로 옆구리가 당기거나 옆구리, 가슴, 배 모두 아픈데 온갖 약으로도 효과가 나지 않는 증상:큰 오두 5개를 뿔을 제거하고 4조각으로 쪼개어 꿀 1근과 함께 꿀이 잘 스며들 때까지 달인 다음 불기운에 말려 가루 낸다. 이것을 별도로 마련한 익힌 꿀에 개어 벽오동씨만 한 환약을 만든다. 이것을 20환씩 소금을 넣고 끓인 물을 차게 하여 복용하면 병증이 영원히 제거된다.《최씨방》",한의학고전DB
CLTX1535,KMH326,본초강목,本草綱目 卷十七 上 > 草之六 毒草類一十七種 > 附子 《本經》下品 > 〔附方〕,"寒疝滑泄, 腹痛腸鳴, 自汗厥逆熟附子去皮臍ㆍ延胡索炒各一兩, 生木香半兩. 每服四錢, 水二盞, 薑七片, 煎七分, 溫服.《濟生方》","한산으로 설사가 줄줄 나거나, 배가 아프고 속에서 우는 소리가 나거나, 자한이 나고 손발이 싸늘해진 증상:숙부자(껍질과 배꼽을 제거한다)ㆍ연호색(볶는다) 각 1냥, 생목향 반 냥. 이상의 약미를 4돈씩 물 2잔과 생강 7쪽을 넣고 10분의 7의 분량이 될 때까지 달여서 따뜻하게 하여 복용한다.《제생방》",한의학고전DB
CLTX1536,KMH326,본초강목,本草綱目 卷十七 上 > 草之六 毒草類一十七種 > 附子 《本經》下品 > 〔附方〕,"小腸諸疝《》倉卒散, 治寒疝腹痛, 小腸氣ㆍ膀胱氣ㆍ脾腎諸痛, 攣急難忍, 汗出厥逆大附子炒去皮臍一枚, 山梔子炒焦四兩, 每用三錢, 水一盞, 酒半盞, 煎七分, 入鹽一捻, 溫服. 《宣明方》治陰疝小腹腫痛, 加藜子等分. 虛者, 加桂枝等分, 薑糊爲丸, 酒服五十丸.","소장의 여러 가지 산기:《소심양방(蘇沈良方)》에서는 ""창졸산(倉卒散)은 한산으로 배가 아픈 증상, 소장기(小腸氣)와 방광기(小腸氣), 비(脾)와 신(腎)의 여러 가지 통증으로 몸이 오그라들어 참을 수 없는 증상, 땀이 나고 손발이 싸늘해진 증상 등을 치료한다. 큰 부자 1개(껍질과 배꼽을 제거한다), 산치자(검게 볶는다) 4냥을 준비해 3돈씩 물 1잔, 술 반 잔과 함께 10분의 7이 될 때까지 달인 다음 소금 1자밤[捻]을 넣어서 따뜻하게 하여 복용한다.""라고 하였다. 《선명방(宣明方)》에서는 ""음산(陰疝)으로 아랫배가 붓고 아픈 증상을 치료할 때는 (창졸산에) 질려자 같은 양을 더한다. 허한 자는 (창졸산에) 계지 같은 양을 더한 다음 생강을 넣고 쑨 풀에 개어 환약을 만들고 술로 50환을 복용한다.""라고 하였다.",한의학고전DB
CLTX1537,KMH326,본초강목,本草綱目 卷十七 上 > 草之六 毒草類一十七種 > 附子 《本經》下品 > 〔附方〕,"虛寒腰痛鹿茸去毛炙微黃ㆍ附子去皮臍各二兩, 鹽花三分, 爲末, 棗肉和丸梧子大. 每服三十丸, 空心溫酒下. 《夷堅志》云, 時康祖大夫, 病心胸一漏, 數竅流汁, 已二十年. 又苦腰痛, 行則, 形神憔悴, 醫不能治. 通判韓子溫爲檢《聖惠方》, 得此方令服. 旬餘, 腰痛減. 久服遂, 心漏亦. 精力倍常, 步履輕捷. 此方本治腰, 而效乃如此.","허한으로 허리가 아픈 증상:녹용(털을 제거하고 연유를 발라 약간 노랗게 되도록 굽는다)ㆍ부자(습지에 싸서 구운 다음 껍질과 배꼽을 제거한다) 각 2냥, 염화(鹽花) 3푼. 이상의 약미를 가루 내고 대추 살에 개어 벽오동씨만 한 환약을 만든다. 이것을 30환씩 빈속에 따뜻한 술로 복용한다. 《이견지(夷堅志)》에서는 ""강조 대부(康祖大夫)는 심흉루저(心胸漏疽)를 앓아 몇 개의 구멍에서 진액이 흘러나오는 증상을 앓은 지 20년이 되었다. 또 허리가 아파 고통스러워 몸을 구부리고 걸어 다녔고 형색이 초췌했는데, 의원들이 치료하지 못하였다. 통판(通判) 한자온(韓子溫)이 《성혜방(聖惠方)》을 살펴보다가 이 처방을 얻어 복용하게 하였다. 10여 일이 지나자 허리의 통증이 줄어들었다. 오래 복용하자 마침내 나았고, 심루저(心漏疽)도 나았으며 정력이 평상시의 배가 되었고 걷는 것도 가볍고 민첩하였다. 이 처방은 본래 허리를 치료하는 것인데 효과가 바로 이와 같다.""라고 하였다.",한의학고전DB
CLTX1538,KMH326,본초강목,本草綱目 卷十七 上 > 草之六 毒草類一十七種 > 附子 《本經》下品 > 〔附方〕,"元臟傷冷《經驗方》用附子去皮臍, 爲末. 以水二盞, 入藥二錢, 鹽ㆍ蔥ㆍ薑ㆍ棗同煎取一盞, 空心服. 去積冷, 暖下元, 肥腸益氣, 酒食無. 《梅師方》二虎丸, 補元臟, 進飮食, 壯筋骨. 用烏頭ㆍ附子合四兩, 醋浸三宿, 切作片子炭火燒赤, 以醋三升, 同藥傾入坑內, 用盆合之. 一宿取出, 去砂土, 入靑鹽四兩, 同炒赤黃色, 爲末, 醋打糊丸如梧子大. 空心冷酒下十五丸, 婦人亦宜.","원장(元臟)이 상했거나 찬 증상:《두문방(斗門方)》에서는 ""부자를 습지에 싸서 구운 다음 껍질과 배꼽을 제거하고 가루 낸다. 물 2잔에 이 약 2돈, 소금, 파, 생강, 대추를 넣고 1잔이 될 때까지 달여서 빈속에 복용한다. 쌓인 냉을 제거하고 하원(下元)을 따뜻하게 하며, 장을 살찌게 하고 기를 붇돋아 주는데, 술과 음식을 먹어도 상관없다.""라고 하였다. 《매사방(梅師方)》에서는 ""이호환(二虎丸)은 원장(元臟)을 보해 주고 입맛을 당기게 하며, 근골을 튼튼하게 한다. 오두와 부자 각 4냥을 진한 식초에 사흘 동안 담갔다가 조각 내어 숯불에 벌겋게 될 때까지 달군다. 식초 3되를 이 약과 함께 구덩이에 넣고 동이로 위를 덮는다. 하룻밤 지나면 꺼내어 모래와 흙을 제거하고 청염(靑鹽) 4냥을 넣어 적황색이 될 때까지 볶고 가루 낸 다음 식초를 넣고 쑨 풀에 개어 벽오동씨만 한 환약을 만든다. 이것을 빈속에 찬 술로 15환을 복용한다. 부인도 복용할 수 있다.""라고 하였다.",한의학고전DB
CLTX1539,KMH326,본초강목,本草綱目 卷十七 上 > 草之六 毒草類一十七種 > 附子 《本經》下品 > 〔附方〕,"胃冷有痰, 脾弱嘔吐生附子ㆍ半夏各二錢, 薑十片, 水二盞, 煎七分, 空心溫服. 一方, 熟, 加木香五分.《奇效良方》","위가 차서 담이 생겼거나 비가 약하여 구토하는 증상:생부자와 반하 각 2돈, 생강 10쪽을 물 2잔에 넣고 10분의 7이 될 때까지 달인 다음 빈속에 따뜻하게 하여 복용한다. 어떤 처방에서는 앞의 약 모두를 습지에 싸서 구워 익힌 다음 목향 5푼을 더하기도 하였다.《기효양방》",한의학고전DB
CLTX1540,KMH326,본초강목,本草綱目 卷十七 上 > 草之六 毒草類一十七種 > 附子 《本經》下品 > 〔附方〕,"久冷反胃《經驗方》用大附子一個, 生薑一斤, 細同煮, 硏如糊. 每米飮化服一錢. 《衛生家寶方》用薑汁打糊, 和附子末爲丸, 大黃爲衣. 每溫水服十丸. 《斗門方》用長大附子一個, 坐於上, 四面著火漸逼, 以生薑自然汁之. 依前再逼再, 約薑汁盡半碗乃止, 硏末. 每服一錢, 粟米飮下, 不過三服. 或以腰子切片, 炙熟食. 《方便集》用大附子一個, 切下頭子, 一竅, 安丁香四十九個在內, 仍合定, 線, 入砂內, 以薑汁浸過, 文火熬乾, 爲末. 每挑少許, 置掌心吃, 日十數次. 忌毒物ㆍ生冷.","오랫동안 속이 차서 반위(反胃)가 된 증상:《경험방(經驗方)》에서는 ""큰 부자 1개, 생강 1근을 잘게 썰어 함께 삶은 다음 밀가루풀처럼 되도록 간다. 이것을 미음에 1돈씩 녹여 복용한다.""라고 하였다. 《위생가보방(衛生家寶方)》에서는 ""생강즙을 넣고 쑨 풀에 부자 가루를 개어 환약을 만든 다음 대황으로 겉을 입힌다. 이것을 따뜻한 물로 10환씩 복용한다.""라고 하였다. 《두문방(斗門方)》에서는 ""가장 큰 부자 1개를 벽돌위에 놓고 사방에 불을 피워 불기운을 쬔 다음 생강 자연즙에 담근다. 다시 앞과 같이 다시 불을 피우고 다시 생강즙에 담그는데 생강즙이 사발절반 정도 사라지면 그치고 가루 낸다. 이것을 1돈씩 좁쌀미음으로 복용하는데, 세 번을 복용하지 않아 낫는다. 혹은 돼지 생식기를 얇게 썰어 구워 익힌 다음 이 약을 찍어 먹는다.""라고 하였다. 《방편집(方便集)》에서는 ""큰 부자 1개를 아랫면을 자른 다음 구멍을 1개 뚫고 정향 49개를 이 구멍에 넣고 잘라낸 아랫면을 덮은 후 끈으로 고정시킨 다음 사기로 만든 냄비에 넣고 생강즙을 넣어 중간불로 생강즙이 마를 때까지 졸여서 가루 낸다. 이것을 조금 떠서 손바닥에 두고 핥아 먹는데, 하루에 10여 차례 한다. 독이 있는 것과 찬 것을 먹지 말아야 한다.""라고 하였다.",한의학고전DB
CLTX1541,KMH326,본초강목,本草綱目 卷十七 上 > 草之六 毒草類一十七種 > 附子 《本經》下品 > 〔附方〕,"脾寒疾《濟生方》云, 五臟氣虛, 陰陽相勝, 發爲, 寒多熱少, 或但寒不熱, 宜七棗湯主之. 用附子一枚, 七次, 鹽湯浸七次, 去皮臍, 分作二服. 水一碗, 生薑七片, 棗七枚, 煎七分, 露一宿. 發日空心溫服, 未久再進一服. 王《百一選方》云, 寒痰宜附子, 風痰宜烏頭法. 用烏頭性熱, 泡多則熱散也. 又果附湯. 用熟附子去皮ㆍ草果仁各二錢半, 水一盞, 薑七片, 棗一枚, 煎七分, 發日早溫服. 《後方》臨發時, 以醋和附子塗於背上.","비(脾)가 차서 생긴 학질:《제생방》에서는 ""오장의 기가 허하고 음양이 한쪽으로 성하여 해학()이 발생하면 한기가 많고 열기가 적거나 혹은 오한만 나고 열은 나지 않는데, 칠조탕(七棗湯)으로 주치한다. 부자 1개를 습지에 싸서 굽기를 7차례 하고, 소금을 넣고 끓인 물에 담그기를 7차례 한 다음 껍질과 배꼽을 제거하고 두 번 복용할 분량으로 나눈다. 이것을 물 1사발, 생강 7족, 대추 7알과 함께 10분의 7이 될 때가지 달여서 하룻밤 이슬을 맞힌다. 학질이 발생하는 날에 빈속에 따뜻하게 하여 복용하고, 조금 있다가 다시 한 번 복용한다.""라고 하였다. 왕구(王)의 《백일선방(百一選方)》에서는 ""한담(寒痰)에는 부자를 쓰는 것이 좋고, 풍담(風痰)에는 오두를 쓰는 것이 좋다. 오두는 성질이 뜨거운데, 물에 불리기를 여러 차례 하면 열이 흩어 진다. 또는 과부탕(果附湯)을 쓴다. 숙부자(껍질을 제거한다)와 초과인 각 2돈 반에 물 1잔, 생강 7쪽, 대추 1알을 넣고 10분의 7이 되도록 달여서 학질이 발생하는 날 아침 일찍 따뜻하게 하여 복용한다.""라고 하였다. 《주후방(後方)》에서는 ""학질이 발생하는 날에 부자 가루를 식초에 개어 등에 발라 준다.""라고 하였다.",한의학고전DB
CLTX1542,KMH326,본초강목,本草綱目 卷十七 上 > 草之六 毒草類一十七種 > 附子 《本經》下品 > 〔附方〕,"寒熱疾附子一枚重五錢者, 人參ㆍ丹砂各一錢, 爲末, 煉蜜丸梧子大. 每服二十丸, 未發前連進三服. 中病則吐, 或身體麻木. 未中病, 來日再服.《龐安常傷寒論》","한열이 나는 학질:부자 1개(무게가 5돈 나가는 것을 밀가루에 싸서 굽는다), 인삼ㆍ단사 각 1돈을 가루 내고 졸인 꿀에 개어 벽오동씨만 한 환약을 만든다. 이것을 20환씩 학질이 발생하기 전에 연거푸 세 차례 복용한다. 병에 잘 맞는 약이면 토하거나 혹은 몸이 마비된다. 병에 잘 맞지 않으면 다음 날 다시 복용한다.《방안상상한론》",한의학고전DB
CLTX1543,KMH326,본초강목,本草綱目 卷十七 上 > 草之六 毒草類一十七種 > 附子 《本經》下品 > 〔附方〕,"寒熱冷, 寒熱往來, 頭痛身疼, 嘔痰, 或汗多引飮, 或自利煩躁, 宜薑附湯主之. 大附子一枚, 四破. 每以一片, 水一盞, 生薑十片, 煎七分, 溫服. 李待制云, 此方極妙. 章傑云, 嶺南以啞爲危急, 不過一二日而死. 醫謂極熱感寒也, 用生附子一味治之多愈. 得非以熱攻熱而發散寒邪乎 眞起死回生之藥也.《嶺南衛生方》","장학()으로 한열이 나는 증상:냉장(冷)으로 한열이 오락가락하고 머리와 몸이 아프며 담을 토하거나, 땀이 많이 나고 물을 켜거나, 설사를 하고 답답해하는 증상에는 강부탕(薑附湯)으로 주치한다. 큰 부자 1개를 4조각낸다. 매 조각마다 물 1잔, 생강 10쪽을 넣고 10분의 7이 될 때까지 달이고 따뜻하게 하여 복용한다. 이 대제(李待制)는 ""이 처방은 매우 오묘하다.""라고 하였다. 장걸(章傑)은 ""영남에서는 아장(啞)을 위급한 병으로 여기는데, 하루 이틀이 지나지 않아 죽었다. 의원이 이것은 열이 극심한데다 감한(感寒)이 걸린 것으로 여기고 생부자 한 약재만으로 치료하자 대부분 나았다. 이것은 열약으로 열증을 공격하여 한사(寒邪)를 발산시키는 것이 아니겠는가. 참으로 기사회생시키는 약이다.""라고 하였다.《영남위생방》",한의학고전DB
CLTX1544,KMH326,본초강목,本草綱目 卷十七 上 > 草之六 毒草類一十七種 > 附子 《本經》下品 > 〔附方〕,"小便虛閉, 兩尺脈沈微用利小水藥不效者, 乃虛寒也. 附子一個去皮臍, 鹽水浸良久, 澤瀉一兩. 每服四錢, 水一盞半, 燈心七莖, 煎服卽愈.《普濟方》","소변이 잘 나오지 않고 양쪽 척맥이 침한 증상:소변을 잘 나오게 하는 약을 약간 써도 효과가 없는 것은 바로 허한하기 때문이다. 부자 1개(습지에 싸서 구운 다음 배꼽과 껍질을 제거하고 소금물에 오랫동안 담가 놓는다), 택사 1냥. 이것을 4돈씩 물 1잔 반, 등심 7줄기와 함께 달여 복용하면 곧 낫는다.《보제방》",한의학고전DB
CLTX1545,KMH326,본초강목,本草綱目 卷十七 上 > 草之六 毒草類一十七種 > 附子 《本經》下品 > 〔附方〕,"腫疾喘滿大人小兒男女腫因積得, 旣取積而腫再作, 小便不利. 若再用利藥性寒, 而小便愈不通矣. 醫者到此多束手. 蓋中焦下焦氣不升降, 爲寒隔, 故水凝而不通. 惟服沈附湯, 則小便自通, 喘滿自愈. 用生附子一箇去皮臍切片, 生薑十片, 入沈香一錢, 磨水同煎, 食前冷飮. 附子雖三五十枚亦無害. 小兒每服三錢, 水煎服.《朱氏集驗方》","종기로 숨이 차고 그득한 증상:남녀노소를 막론하고 적취로 인해 붓거나 이미 적취로 종기가 다시 생겨서 소변이 나오지 않는 증상이다. 다시 소변을 잘 나오게 하는 성질이 차가운 약을 쓴다면 소변이 더욱 잘 나오지 않을 것이다. 의원들은 이러한 병에 이르러 대부분 속수무책이 된다. 이것은 중초와 하초의 기가 오르내리지 못하고 한기가 가슴에 막혔기 때문에 수(水)가 엉겨서 통하지 않기 때문이다. 침부탕(沈附湯)을 복용해야만 소변이 저절로 통하고 숨이 차고 그득한 증상이 저절로 낫는다. 생부자 1개(껍질과 배꼽을 제거하고 조각낸다.), 생강 10쪽에 침향 1돈을 넣고 물에 갈아서 함께 달인 다음 식전에 차게 하여 복용한다. 부자는 30-50개를 써도 해가 없다. 어린아이는 3돈씩 물에 달여 먹인다.《주씨집험방》",한의학고전DB
