고문헌자료아이디,한약재아이디,한의서명,수록위치,고문헌원문,번역문,번역문출처
CLTX2213,KMH584,본초강목,本草綱目 卷十二上 > 草之一 山草類上一十三種 > 人參 《本經》上品 > 根 > 正誤,"言聞曰孫眞人云, 夏月服生脈散ㆍ腎瀝湯三劑, 則百病不生. 李東垣亦言生脈散ㆍ淸暑益氣湯, 乃三伏瀉火益金之聖藥, 而雷斅反謂發心久患非矣. 乃臍旁積氣, 非心病也. 人參能養正破堅積, 豈有發之理 觀張仲景治腹中寒氣上沖, 有頭足, 上下痛不可觸近, 嘔不能食者, 用大建中湯, 可知矣. 又海藏王好古言人參補陽泄陰, 肺寒宜用, 肺熱不宜用. 節齋王綸因而和之, 謂參ㆍ耆能補肺火, 陰虛火動失血諸病, 多服必死. 二家之說皆偏矣. 夫人參能補元陽, 生陰血, 而瀉陰火, 東垣李氏之說也明矣. 仲景張氏言亡血血虛者, 加人參;又言肺寒者, 去人參, 加乾薑, 無令氣壅. 丹溪朱氏亦言虛火可補, 參ㆍ耆之屬;實火可瀉, 芩ㆍ連之屬. 二家不察三氏之精微, 而謂人參補火, 謬哉. 夫火與元氣不兩立, 元氣勝則邪火退. 人參旣補元氣而又補邪火, 是反復之小人矣, 何以與甘草ㆍㆍ朮謂之四君子耶 雖然, 三家之言不可盡廢也. 惟其語有滯, 故守之者泥而執一, 遂視人參加蛇, 則不可也. 凡人面白ㆍ面黃ㆍ面靑悴者, 皆脾ㆍ肺ㆍ腎氣不足, 可用也;面赤ㆍ面黑者, 氣壯神强, 不可用也. 脈之浮而濡虛大遲緩無力, 沈而遲弱細結代無力者, 皆虛而不足, 可用也;若弦長緊實滑數有力者, 皆火鬱內實, 不可用也. 潔古謂喘嗽勿用者, 痰實氣壅之喘也;若腎虛氣短喘促者, 必用也. 仲景謂肺寒而咳勿用者, 寒束熱邪壅鬱在肺之咳也;若自汗惡寒而咳者, 必用也. 東垣謂久病鬱熱在肺勿用者, 乃火鬱於內宜發不宜補也;若肺虛火旺, 氣短自汗者, 必用也. 丹溪言諸痛不可驟用者, 乃邪氣方銳, 宜散不宜補也;若裏虛吐利及久病胃弱虛痛喜按者, 必用也. 節齋謂陰虛火旺勿用者, 乃血虛火亢能食, 脈弦而數, 之則傷胃, 溫之則傷肺, 不受補者也. 若自汗氣短, 肢寒脈虛者, 必用也. 如此詳審, 則人參之可用不可用, 思過半矣.","이언문은 ""손진인은 '여름철에 생맥산과 신력탕(腎瀝湯) 3첩을 복용하면 온갖 병이 생기지 않는다.' 하였고, 이동원도 '생맥산과 청서익기탕(淸暑益氣湯)은 삼복에 화를 쓸어내리고 금을 보익해 주는 성약이다.' 하였지만, 뇌효(雷斅)는 도리어 '심을 당기게 하는 병증이 발생한다.' 하였는데, 잘못된 것이다. 당기는 증상은 배꼽 곁에 쌓인 기 때문이지 심의 병이 아니다. 인삼은 정기를 기르고 단단한 적(積)을 깨뜨릴 수 있으니 어찌 당기는 증상이 발생할 이유가 있겠는가. 장중경이 배 속의 한기가 상부로 치받는 증상으로 머리에서 발까지 위아래로 건드릴 수 없을 정도로 아프고 구역질로 음식을 먹지 못하는 증상을 치료할 때 쓰는 대건중탕(大建中湯)을 보면 알 수 있다. 또한 해장(海藏) 왕호고는 '인삼은 양을 보해 주고 음을 쓸어내리니 폐의 한증에는 써야 하고 폐의 열증에는 쓰지 말아야 한다.' 하였고, 절재(節齋) 왕륜은 이에 화답하여 '인삼과 황기는 폐화를 보해 주는데, 음허화동으로 인한 실혈 등의 병에 많이 복용하면 반드시 죽을 것이다.' 하였다. 두 학자의 설은 모두 한쪽으로 치우쳤다. 인삼은 원양(元陽)을 보하고 음혈을 생성하면서 음화를 쓸어내린다는 동원 이씨의 설이 명백하다. 중경 장씨는 '망혈이나 혈허에는 모두 인삼을 더한다.' 하였고, 또한 '폐의 한증에는 인삼을 빼고 건강을 더하여 기가 막히지 않도록 해야 한다.' 하였으며, 단계(丹溪) 주씨도 '허화(虛火)에 보할 수 있는 것은 인삼과 황기 등이고, 실화(實火)에 쓸어내릴 수 있는 것은 황금과 황련 등이다.' 하였는데, 두 학자는 세 사람[三氏]의 정미한 내용을 살피지 못하고 인삼이 화를 보해 준다고 하였으니 잘못되었다. 화와 원기는 함께 세울 수 없으니, 원기가 이기면 사화는 물러간다. 인삼이 원기를 보해 주었는데, 또다시 사화를 보해 준다는 것은 소인(小人)이 반복되는 것이지 어찌 감초ㆍ복령ㆍ백출과 함께 사군자(四君子)라 말하겠는가. 그렇더라도 세 학자의 말을 다 폐할 수는 없다. 그 말에 막힘이 있으므로 고수하는 자는 진득하게 고집하여 마침내 인삼에 뱀과 전갈을 더하면 안된다는 것을 보았다. 사람의 얼굴이 희거나 누렇거나 검푸르게 되어 초췌한 자는 모두 폐, 비, 신의 기가 부족하기 때문이니 쓸 수 있고, 얼굴이 붉거나 검은 자는 기가 튼튼하고 신이 강하기 때문이니 쓸 수 없다. 맥이 부(浮)하면서 규()하거나 유(濡)하거나 허(虛)하거나 대(大)하거나 지(遲)하거나 완(緩)하여 힘이 없고, 침(沈)하면서 지(遲)하거나 삽()하거나 약(弱)하거나 세(細)하거나 결(結)하거나 대(代)하여 힘이 없는 자는 모두 허하면서 부족하기 때문이니 쓸 수 있고, 현(弦)하거나 장(長)하거나 긴(緊)하거나 실(實)하거나 활(滑)하거나 삭(數)하여 힘이 있는 자는 모두 화가 울결되어 속에서 실하기 때문이니 쓸 수 없다. 결고(潔古)가 숨을 헐떡이고 기침이 나면 쓸 수 없다고 말한 것은 담이 실하여 기가 막혀서 숨을 헐떡이기 때문인데, 신이 허하여 기가 짧고 숨을 헐떡이는 자는 반드시 써야 한다. 중경이 폐의 한증으로 기침이 나면 쓸 수 없다고 말한 것은 한이 묶이고 열사가 막혀 폐에 뭉쳐 있어서 기침이 나기 때문인데, 자한과 오한이 나면서 기침이 나면 반드시 써야 한다. 동원이 오랜 병으로 열이 폐에 울결되어 있으면 쓰지 말아야 한다고 말한 것은 폐가 안에서 울결되어 있으면 발산시켜야지 보해 주어서는 안 되기 때문인데, 폐가 허하고 화가 왕성하여 숨이 짧고 자한이 나면 반드시 써야 한다. 단계가 여러 가지 통증에 급하게 쓰지 말라고 말한 것은 사기가 강한 상태일 때는 흩어 내야지 보해 주어서는 안 되기 때문인데, 속이 허하여 구토와 설사가 나거나 오랜 병으로 위(胃)가 허약하여 누르면 아픈 자는 반드시 써야 한다. 절재가 음허하여 화가 왕성하면 쓰지 말아야 한다고 말한 것은 혈이 허하고 화가 올라 음식을 잘 먹고 맥이 현하면서 삭할 때 서늘하게 하면 위를 상하고 따뜻하게 하면 폐를 상하여 보할 수 없기 때문이다. 자한이 나고 숨이 짧으며 팔다리가 차고 맥이 허한 자는 반드시 써야 한다. 이와 같이 상세히 살핀다면 인삼을 쓰거나 쓰지 않아야 할 경우를 절반은 알게 된다.""라고 하였다.",한의학고전DB
CLTX2214,KMH584,본초강목,本草綱目 卷十二上 > 草之一 山草類上一十三種 > 人參 《本經》上品 > 根 > 正誤,"機曰節齋王綸之說, 本於海藏王好古, 但綸又過於矯激. 丹溪言虛火可補, 須用參ㆍ耆. 又云陰虛潮熱, 喘嗽吐血, 盜汗等證, 四物加人參ㆍ黃蘗ㆍ知母. 又云好色之人, 肺腎受傷, 咳嗽不愈, 瓊玉膏主之. 又云肺腎虛極者, 獨參膏主之. 是知陰虛勞之證, 未嘗不用人參也. 節齋, 私淑丹溪者也, 而乃相反如此. 斯言一出, 印定後人眼目. 凡遇前證, 不問病之宜用不宜, 輒擧以藉口. 致使良工, 惟求免夫病家之怨. 病家亦以此說橫之胸中, 甘受苦寒, 雖至上嘔下泄, 去死不遠, 亦不悟也. 古今治勞莫過於葛可久, 其獨參湯ㆍ保眞湯, 何嘗廢人參而不用耶 節齋之說, 誠未之深思也.","왕기(汪機)는 ""절재 왕륜의 설은 해장 왕호고에 근본하였지만 왕륜은 더욱 지나치게 과격하였다. 단계는 '허화에는 보할 수 있으므로 인삼과 황기를 써야 한다.' 하였고, 또한 '음허와 조열로 숨을 헐떡이거나 피를 토하거나 도한 등의 증상이 있을 때는 사물탕에 인삼ㆍ황벽ㆍ지모를 더한다.' 하였다. 또한 '색을 좋아하는 사람이 폐와 신을 상하여 기침이 낫지 않을 때는 경옥고(瓊玉膏)로 주치한다.' 하였고, 또한 '폐와 신이 매우 허하면 독삼고(獨參膏)로 주치한다.' 하였다. 이는 음허로 인한 노채 등의 증상에는 인삼을 쓰지 않은 적이 없음을 알 수 있다. 절재가 단계의 설에는 공손하였지만 이와 같이 상반된다. 이 말은 한 곳에서 나와서 후대 사람들의 눈에 고정되었다. 이전 증상에서는 병에 따라 써야 할지 말아야 할지를 묻지 않고 사람의 취향만 급하게 들었는데, 뛰어난 자를 간섭하여 환자의 원망을 면하는 것만 구하고자 한 것이다. 환자 또한 이 설을 마음에 두고 쓰고 찬 것을 달게 받아들였으니 위로는 토하고 아래로는 설사시키더라도 죽음이 머지않았으나 깨닫지 못한다. 예나 지금이나 노채증을 치료할 때는 갈가구(葛可久)의 독삼탕과 보진탕(保眞湯)만 한 것이 없으니, 인삼을 폐하여 쓰지 않은 적이 언제 있던가. 절재의 설은 진실로 깊이 생각하지 못한 것이다.""라고 하였다.",한의학고전DB
CLTX2215,KMH584,본초강목,本草綱目 卷十二上 > 草之一 山草類上一十三種 > 人參 《本經》上品 > 根 > 正誤,"楊起曰人參功載本草, 人所共知. 近因病者吝財薄醫, 醫復算本惜費, 不肯用參療病, 以致輕者至重, 重者至危. 然有肺寒ㆍ肺熱ㆍ中滿ㆍ血虛四證, 只宜散寒ㆍ消熱ㆍ消脹ㆍ補營, 不用人參, 其說近是;殊不知各加人參在內, 護持元氣, 力助群藥, 其功更捷. 若曰氣無補法, 則謬矣. 古方治肺寒以溫肺湯, 肺熱以淸肺湯, 中滿以分消湯, 血虛以養營湯, 皆有人參在焉. 所謂邪之所輳, 其氣必虛. 又曰養正邪自除, 陽旺則生陰血, 貴在配合得宜爾. 庸醫每謂人參不可輕用, 誠哉庸也. 好生君子, 不可輕命薄醫, 醫亦不可計利不用. 書此奉勉, 幸勿曰迂.","양기(楊起)는 ""본초서에 실려 있는 인삼의 효과는 사람들이 모두 알고 있는 것이다. 근래 환자는 돈에 인색하고 치료에 소홀하며, 의원은 다시 본전을 계산하고 비용을 아까워하여 인삼을 써서 잘 치료하려 하지 않으므로 병이 가벼운 자는 심해지고, 심한 자는 위독해진다. 그러나 폐의 한증, 폐의 열증, 속이 그득한 증상, 헐허의 네 가지 증상은 한기를 흩어 내거나, 열을 없애거나, 불러오른 것을 삭이거나, 영(營)을 보해 주어야 하므로 인삼을 쓸 수 없으니, 그 설이 거의 옳다. 인삼을 얼마나 더하였는지 알지 못할 때 원기를 보호하고자 하여 여러 가지 약으로 약력을 돕는다면 그 효과가 다시 신속해진다. 만약 기에 보해 주는 방법이 없다고 말한다면 잘못된 것이다. 옛 처방에서는 폐의 한증은 온폐탕(溫肺湯)으로 치료하였고 폐의 열증은 청폐탕(淸肺湯)으로 치료하였고 속이 그득한 증상은 분소탕(分消湯)으로 치료하였고 혈허는 양영탕(養營湯)으로 치료하였는데, 모두 인삼이 들어 있다. 이른바 사기가 모여 있는 곳은 그 기가 반드시 허하다. 또한 정기를 기르면 사기가 저절로 제거되고 양이 왕성하면 음혈이 생성된다고 말한 것은 배합이 마땅한 것을 중요하게 여길 따름이다. 어리석은 의원은 매번 인삼을 경솔하게 쓸 수 없다고 말하는데, 참으로 어리석다. 살리는 것을 좋아하는 군자는 명을 가벼이 여겨 치료에 소홀할 수 없고, 의원도 이익을 계산하여 쓰지 않으면 안 된다. 이 글을 써서 받들고 힘써야지 요행히 하여 우활하다 말하지 말라.""라고 하였다.",한의학고전DB
CLTX2216,KMH584,본초강목,本草綱目 卷十二上 > 草之一 山草類上一十三種 > 人參 《本經》上品 > 根 > 附方,"人參膏用人參十兩細切, 以活水二十盞浸透, 入銀石器內, 桑柴火緩緩煎取十盞, 濾汁, 再以水十盞, 煎取五盞, 與前汁合煎成膏, 收, 隨病作湯使. 丹溪云, 多慾之人, 腎氣衰憊, 咳嗽不止, 用生薑ㆍ橘皮煎湯, 化膏服之. 浦江鄭兄, 五月患痢, 又犯房室, 忽發昏運, 不知人事, 手撒目暗, 自汗如雨, 喉中痰鳴如曳鋸聲, 小便遺失, 脈大無倫, 此陰虧陽絶之證也. 予令急煎大料人參膏, 仍與灸氣海十八壯, 右手能動, 再三壯, 唇口微動, 遂與膏服一盞, 半夜後服三盞, 眼能動, 盡三斤, 方能言而索粥, 盡五斤而痢止, 至十斤而全安, 若作風治則誤矣. 一人背疽, 服內托十宣藥已多, 膿出作嘔, 發熱, 六脈沈數有力, 此潰瘍所忌也. 遂與大料人參膏, 入竹瀝飮之, 參盡一十六斤, 竹伐百餘竿而安. 後經旬餘, 値大風拔木, 瘡起有膿, 中有紅線一道, 過肩胛, 抵右肋. 予曰, 急作參膏, 以芎ㆍ歸ㆍ橘皮作湯, 入竹瀝ㆍ薑汁飮之. 盡三斤而瘡潰, 調理乃安. 若癰疽潰後, 氣血俱虛, 嘔逆不食, 變證不一者, 以參ㆍ耆ㆍ歸ㆍ朮等分, 煎膏服之, 最妙.","인삼고:인삼 10냥을 잘게 썰고 활수(活水) 20잔을 넣어 스며들게 한 다음 은이나 돌로 된 그릇에 넣는다. 뽕나무 가지로 불을 피워 천천히 10잔이 될 때까지 졸이고 걸러낸 즙에 다시 앞의 인삼에 물 10잔을 넣고 5잔이 될 때까지 달인 다음 먼저 걸러 낸 즙과 합치고 졸여 고(膏)를 만든다. 이것을 병에 담아 두었다가 병증에 따라 탕약을 만들어 쓴다. 단계는 ""욕심이 많은 사람이 신기(腎氣)가 노쇠하고 약해져 기침이 멎지 않을 때는 생강과 귤피를 넣고 달인 물에 인삼고를 녹여 복용한다. 포강(浦江)에 사는 정형(鄭兄)이 5월에 이질을 앓았는데, 또한 성교를 함부로 하여 갑자기 침침하고 어질어질하여 인사불성이 되었다. 팔을 허우적거리고 눈이 어두웠으며 땀이 비오듯 쏟아졌고 목구멍 속에 담이 있어 톱으로 써는 듯한 소리가 들렸으며 소변을 지리고 맥이 대(大)하면서 간격이 없었는데, 이는 음이 휴손되고 양이 끊어진 증상이다. 내가 급히 인삼고를 달여 대량으로 복용하도록 하였고 기해혈(氣海穴)에 뜸을 18장 뜨자 오른쪽 손을 움직일 수 있었다. 두세 번 다시 뜨자 입술과 입이 조금 움직였다. 마침내 인삼고 1잔을 복용하고 밤중에 3잔을 복용하자 눈을 떴고, 3근을 다 쓰자 말을 할 수 있어서 죽을 찾았다. 5근을 다 쓰자 이질이 멎었고, 10근을 쓰자 모든 것이 안정되었다. 만약 풍을 치료하는 약을 만들면 잘못된다. 어떤 사람이 배저(背疽)를 앓고 있어 내탁십선약(內托十宣藥)을 많이 복용하였는데, 고름이 나오자 구토를 하고 열이 났으며, 육맥이 침삭하고 힘이 있었다. 이는 궤양에서 금기하는 약이다. 마침내 인삼고에 죽력을 넣어 많이 복용하도록 하였는데, 인삼을 16근 쓰고 대나무 100여 자루를 쓰자 안정되었다. 이후 10여 일이 지나 큰 바람이 불어 나무가 뽑히자 창이 일어나 고름이 잡혔고 속에 붉은 핏줄 한 가닥이 어깨를 지나 오른쪽 갈빗대까지 이르럿다. 나는 '빨리 인삼고를 만들고 천궁ㆍ당귀ㆍ귤피를 달인 물에 죽력과 강즙을 넣어 마시게 하라.'라고 말하였다. 3근을 쓰자 창이 터졌고, 조리하자 바로 안정되었다. 옹저가 터진 뒤에 기혈이 모두 허하고 구역질이 나서 음식을 먹지 못할 때의 변증은 한 가지가 아니다. 인삼ㆍ황기ㆍ당귀ㆍ백출 같은 양을 달여 낸 고를 복용하는 것이 가장 신묘한 효과가 있다.""라고 하였다.",한의학고전DB
CLTX2217,KMH584,본초강목,本草綱目 卷十二上 > 草之一 山草類上一十三種 > 人參 《本經》上品 > 根 > 附方,"治中湯頌曰, 張仲景治胸痺, 心中堅, 留氣結胸, 胸滿, 脅下逆氣心, 治中湯主之. 卽理中湯, 人參ㆍ朮ㆍ乾薑ㆍ甘草各三兩, 四味以水八升, 煮三升, 每服一升, 日三服, 隨證加減. 此方自晉宋以後至唐名醫, 治心腹病者, 無不用之, 或作湯, 或蜜丸, 或爲散, 皆有奇效. 胡洽居士治亂, 謂之溫中湯. 陶隱居《百一方》云, 亂餘藥乃或難求, 而治中方ㆍ四順湯ㆍ厚朴湯不可暫缺, 常須預合自隨也. 唐石泉公王方慶云, 數方不惟亂可醫, 諸病皆療也. 四順湯, 用人參ㆍ甘草ㆍ乾薑ㆍ附子各二兩, 水六升, 煎二升半, 分四服.","치중탕:소송은 ""장중경은 흉비(胸痺)로 명치가 막히고 단단하며 남아 있는 기가 가슴 속에 뭉쳐 있어 가슴이 그득하고 옆구리 아래에서 기가 거슬러 심(心)을 치받는 증상을 치료할 때 치중탕으로 주치하였다. 즉 이중탕(理中湯) 재료인 인삼ㆍ백출ㆍ건강ㆍ감초 각 3을 쓰는데, 이 네 가지 약미에 물 8되를 넣고 3되가 될 때까지 달인 다음 1되씩 하루 세 번 복용하고, 증상에 따라 약재를 가감한다. 이 처방은 진(晉)나라와 송(宋)나라부터 이후 당(唐)나라의 명의까지 가슴과 배의 병증을 치료할 때 쓰지 않은 경우가 없는데, 탕약을 만들거나 혹은 꿀에 개어 환약을 만들거나 혹은 가루로 만들어도 모두 기이한 효과가 있다. 호흡거사(胡洽居士)가 곽란을 치료한 것은 온중탕(溫中湯)을 말한다. 도은거(陶隱居)의 《백일방(百一方)》에서는 '곽란에 걸린 뒤에는 혹 약을 구하기 어려울 수 있으니, 치중탕 처방, 사순탕(四順湯), 후박탕(厚朴湯)을 잠시도 빼먹어서는 안되고 늘 미리 준비해 두었다가 증상에 따라 써야 한다.' 하였다. 당나라 석천공(石泉公) 왕방경(王方慶)은 '여러 가지 처방 중에 곽란을 치료할 뿐만 아니라 여러 가지 병증을 모두 치료한다. 사순탕 재료인 인삼ㆍ감초ㆍ건강ㆍ부자(습지에 싸서 굽는다) 각 2냥에 물 6되를 넣고 2되 반이 될 때까지 달인 다음 네 차례에 나누어 복용한다.' 하였다.""라고 하였다.",한의학고전DB
CLTX2218,KMH584,본초강목,本草綱目 卷十二上 > 草之一 山草類上一十三種 > 人參 《本經》上品 > 根 > 附方,"四君子湯治脾胃氣虛, 不思飮食, 諸病氣虛者, 以此爲主. 人參一錢, 白朮二錢, 白茯一錢, 炙甘草五分, 薑三片, 棗一枚. 水二鍾, 煎一鍾, 食前溫服. 隨證加減.《和劑局方》","사군자탕:비위의 기가 허하여 음식 생각이 나지 않거나 여러 가지 병으로 기가 허한 자는 이것으로 주치한다. 인삼 1돈, 백출 2돈, 백복령 1돈, 구감초 5푼, 생강 3조각, 대추 1알. 이상의 약미에 물 2잔을 넣고 1잔이 될 때까지 달인 다음 식전에 따뜻하게 하여 복용한다. 증상에 따라 가감한다.《화제국방》",한의학고전DB
CLTX2219,KMH584,본초강목,本草綱目 卷十二上 > 草之一 山草類上一十三種 > 人參 《本經》上品 > 根 > 附方,"開胃化痰不思飮食, 不拘大人小兒. 人參焙二兩, 半夏薑汁浸焙五錢. 爲末, 飛羅作糊, 丸綠豆大. 食後薑湯下三五十丸, 日三服. 《聖惠方》加陳橘皮五錢.《經驗方》","위를 열고 담을 삭이는 방법:음식 생각이 나지 않을 때 대인과 소아를 막론하고 쓸 수 있다. 인삼(불기운에 말린다) 2냥, 반하(생강즙에 담갔다가 불기운에 말린다) 5돈. 이상의 약미를 가루 내고 비라면을 넣고 쑨 풀에 개어 녹두만 한 환약을 만든다. 이것을 30-50환씩 하루 세 번 식후에 생강 달인 물로 복용한다. 《성혜방(聖惠方)》에서는 진귤피 5돈을 더하였다.《경험후방》",한의학고전DB
CLTX2220,KMH584,본초강목,本草綱目 卷十二上 > 草之一 山草類上一十三種 > 人參 《本經》上品 > 根 > 附方,"胃寒氣滿不能傳化, 易飢不能食人參末二錢, 生附子末半錢, 生薑二錢. 水七合, 煎二合, 子淸一枚, 打轉空心服之.《聖濟總錄》","위(胃)에 한기가 그득하여 소화시키지 못하고 쉽게 굶주려 음식을 먹지 못하는 증상:인삼 가루 2돈, 생부자 가루 반 돈, 생강 2돈. 이상의 약미에 물 7홉을 넣고 2홉이 될 때까지 달인 다음 계란 흰자 1개를 섞어 빈속에 복용한다.《성제총록》",한의학고전DB
CLTX2221,KMH584,본초강목,本草綱目 卷十二上 > 草之一 山草類上一十三種 > 人參 《本經》上品 > 根 > 附方,"脾胃虛弱, 不思飮食生薑半斤取汁, 白蜜十兩, 人參末四兩. 銀鍋煎成膏. 每米飮調服一匙.《普濟方》","비위가 허약하여 음식 생각이 나지 않는 증상:생강 반 근을 즙을 내고 백밀 10냥, 인삼 가루 4냥과 함께 은으로 만든 솥에 넣고 졸여 고를 만든다. 이것을 미음으로 1술씩 복용한다.《보제방》",한의학고전DB
CLTX2222,KMH584,본초강목,本草綱目 卷十二上 > 草之一 山草類上一十三種 > 人參 《本經》上品 > 根 > 附方,"胃虛惡心, 或嘔吐有痰人參一兩, 水二盞, 煎一盞, 入竹瀝一盃, 薑汁三匙, 食遠溫服, 以知爲度, 老人尤宜.《簡便方》","위가 허하여 속이 메스껍거나 담을 구토하는 증상:인삼 1냥을 물 2잔에 넣고 1잔이 될 때까지 달인 다음 죽력 1잔과 생강즙 3술을 넣고 식사 후 한참 뒤에 따뜻하게 하여 복용한다. 병이 나을 때까지 복용하는데, 노인에게 더욱 알맞다.《간편방》",한의학고전DB
CLTX2223,KMH584,본초강목,本草綱目 卷十二上 > 草之一 山草類上一十三種 > 人參 《本經》上品 > 根 > 附方,"胃寒嘔惡, 不能腐熟水穀, 食卽嘔吐人參ㆍ丁香ㆍ藿香各二錢半, 橘皮五錢, 生薑三片, 水二盞, 煎一盞, 溫服.《拔萃方》","위가 차서 구토가 나거나 메스꺼워 물과 곡식을 소화시키지 못하며 음식을 먹으면 바로 토해 내는 증상:인삼ㆍ정향ㆍ곽향 각 2돈 반, 귤피 5돈, 생강 3조각을 물 2잔에 넣고 1잔이 될 때까지 달인 다음 따뜻할 때 복용한다.《발췌방》",한의학고전DB
CLTX2224,KMH584,본초강목,本草綱目 卷十二上 > 草之一 山草類上一十三種 > 人參 《本經》上品 > 根 > 附方,"反胃嘔吐飮食入口卽吐, 困弱無力, 垂死者. 上黨人參三大兩拍破, 水一大升, 煮取四合, 熱服, 日再. 兼以人參汁, 入粟米ㆍ子白ㆍ白, 煮粥與. 李直方司勳, 於漢南患此, 兩月餘, 諸方不. 遂與此方, 當時便定. 後十餘日, 遂入京師. 絳每與名醫論此藥, 難可爲也.《李絳兵部手集》","반위로 구토하는 증상:음식이 입으로 들어가면 즉시 토하고, 몸이 허약하여 힘이 없어서 죽으려 한다. 상당인삼 3큰냥을 두들겨 부수고 물 1큰되에 넣어 4홉이 될 때까지 삶은 다음 뜨거울 때 하루 두 번 복용한다. 아울러 인삼즙에 좁쌀, 계란 흰자, 해백을 넣고 죽을 쑤어 먹는다. 직방(直方) 이 사훈(李司勳)은 한남(漢南)에서 이 증상을 앓았는데, 2개월 동안 여러 처방을 써도 낫지 않았다. 마침내 이 처방을 쓰자 곧 안정되었다. 10여 일 뒤에 마침내 경사(京師)로 들어갔다. 이강(李絳)이 매번 명의가 이 약을 논하였지만 비교하기가 어려웠다.《이강병부수집방》",한의학고전DB
CLTX2225,KMH584,본초강목,本草綱目 卷十二上 > 草之一 山草類上一十三種 > 人參 《本經》上品 > 根 > 附方,"食入卽吐人參半夏湯. 用人參一兩, 半夏一兩五錢, 生薑十片. 水一斗, 以杓揚二百四十遍, 取三升, 入白蜜三合, 煮一升半, 分服.《張仲景金方》","음식이 들어가면 즉시 토하는 증상:인삼반하탕(人參半夏湯)을 쓴다. 인삼 1냥, 반하 1냥 5돈, 생강 3쪽. 이상의 약미에 물 1되를 넣고 국자로 240번 떠서 3되가 되면 꿀 3홉을 넣고 1되가 될 때까지 달인 다음 두 번에 나누어 복용한다.《장중경금궤방》",한의학고전DB
CLTX2226,KMH584,본초강목,本草綱目 卷十二上 > 草之一 山草類上一十三種 > 人參 《本經》上品 > 根 > 附方,"亂嘔惡人參二兩, 水一盞半, 煎汁一盞, 入子白一枚, 再煎溫服. 一加丁香.《衛生家寶方》",곽란으로 구역질이 나거나 속이 메스꺼운 증상:인삼 2냥에 물 1잔 반을 넣고 달여 낸 즙 1잔을 계란 흰자 1개를 넣고 다시 달여 따뜻할 때 복용한다. 혹 정향을 더하기도 한다.《위생가보방》,한의학고전DB
CLTX2227,KMH584,본초강목,本草綱目 卷十二上 > 草之一 山草類上一十三種 > 人參 《本經》上品 > 根 > 附方,"亂煩悶人參五錢, 桂心半錢. 水二盞, 煎服.《聖惠方》","곽란으로 답답한 증상:인삼 5돈, 계지 반 돈에 물 2잔을 넣고 달여 복용한다.《성혜방》",한의학고전DB
